<S2SCTCvf:SCTCvfBlkCredTrf xmlns:S2SCTCvf="urn:S2SCTCvf:xsd:$SCTCvfBlkCredTrf" xmlns:p="urn:iso:std:iso:20022:tech:xsd:pacs.002.001.02S2" xmlns:xsi="http://www.w3.org/2001/XMLSchema-instance" xsi:schemaLocation="urn:S2SCTCvf:xsd:$SCTCvfBlkCredTrf SCTCvfBlkCredTrf.xsd urn:iso:std:iso:20022:tech:xsd:pacs.002.001.02S2 pacs.002.001.02S2.xsd ">
  <S2SCTCvf:SndgInst><?= $params['receiver'] ?></S2SCTCvf:SndgInst>
  <S2SCTCvf:RcvgInst><?= $params['sender'] ?></S2SCTCvf:RcvgInst>
  <S2SCTCvf:SrvcId><?= 'SCT' ?></S2SCTCvf:SrvcId>
  <S2SCTCvf:TstCode>T</S2SCTCvf:TstCode>
  <S2SCTCvf:FType><?= 'CVF' ?></S2SCTCvf:FType>
  <S2SCTCvf:FileRef><?= $outref ?></S2SCTCvf:FileRef>
  <S2SCTCvf:FileDtTm><?= gmdate('Y-m-d\TH:i:s\Z') ?></S2SCTCvf:FileDtTm>
  <S2SCTCvf:OrigFRef><?= $params['ref'] ?></S2SCTCvf:OrigFRef>
  <S2SCTCvf:OrigFName><?= $file ?></S2SCTCvf:OrigFName>
  <S2SCTCvf:OrigDtTm><?= $params['filedate'] ?></S2SCTCvf:OrigDtTm>
  <S2SCTCvf:FileRjctRsn><?= $params['error'] ?></S2SCTCvf:FileRjctRsn>
  <S2SCTCvf:FileBusDt><?= gmdate('Y-m-d') ?></S2SCTCvf:FileBusDt>
  <S2SCTCvf:FileCycleNo>01</S2SCTCvf:FileCycleNo>
</S2SCTCvf:SCTCvfBlkCredTrf>
